{
  "taskId": "b038-s4-remove",
  "selectedBindingId": "binding-tool.msvc",
  "provenance": {
    "source": "winget",
    "official": true,
    "version": "15.2.0",
    "hash": "71b2fef860abe467217a538ff31de02f5258807c0129f771846f87bd029aafc5",
    "signature": "authenticode:BurntSushi",
    "licenseDisposition": "Dual License (MIT & Unlicense) accepted for task use"
  },
  "taskResult": {
    "status": "SUCCEEDED",
    "verification": {
      "taskId": "b038-s4-remove",
      "verifierId": "verifier.jit-cli",
      "verifierRevision": "r1",
      "status": "PASS",
      "checks": [
        {
          "checkId": "provider-task-observable",
          "status": "PASS",
          "detail": "task output names the exact acquired version 15.2.0"
        }
      ],
      "oracleInputs": {
        "expectedVersion": "15.2.0",
        "actualStdout": "ripgrep 15.2.0 (rev e89fff89ac)\n\nfeatures:+pcre2\nsimd(compile):+SSE2,-SSSE3,-AVX2\nsimd(runtime):+SSE2,+SSSE3,+AVX2\n\nPCRE2 10.45 is available (JIT is available)\n"
      },
      "evidenceRefs": [
        "evidence\\b038-run-20261010\\s4-task-out\\stdout.txt"
      ]
    }
  },
  "lifecycleState": {
    "providerId": "tool.msvc",
    "version": "15.2.0",
    "state": "REMOVED"
  },
  "residueReport": {
    "candidates": [
      {
        "path": "C:\\Users\\15549\\AppData\\Local\\Microsoft\\WinGet\\Packages\\BurntSushi.ripgrep.MSVC_Microsoft.Winget.Source_8wekyb3d8bbwe",
        "classification": "PROGRAM_OWNED",
        "disposition": "DELETE"
      },
      {
        "path": "C:\\Users\\15549\\AppData\\Local\\Microsoft\\WinGet\\Packages\\BurntSushi.ripgrep.MSVC_Microsoft.Winget.Source_8wekyb3d8bbwe\\BurntSushi.ripgrep.MSVC_Microsoft.Winget.Source_8wekyb3d8bbwe.db",
        "classification": "PROGRAM_OWNED",
        "disposition": "DELETE"
      },
      {
        "path": "C:\\Users\\15549\\AppData\\Local\\Microsoft\\WinGet\\Packages\\BurntSushi.ripgrep.MSVC_Microsoft.Winget.Source_8wekyb3d8bbwe\\ripgrep-15.2.0-x86_64-pc-windows-msvc",
        "classification": "PROGRAM_OWNED",
        "disposition": "DELETE"
      }
    ],
    "unknownOrProtectedDeleted": false
  },
  "r2Gate": {
    "phases": [
      "PLAN",
      "PREVIEW",
      "CHECKPOINT",
      "APPROVAL",
      "EXECUTE",
      "VERIFY"
    ],
    "approvedBy": "DURABLE_POLICY"
  },
  "finalState": "REMOVED"
}