{
  "taskId": "b038-s1-retain",
  "selectedBindingId": "binding-tool.jq",
  "provenance": {
    "source": "winget",
    "official": true,
    "version": "1.8.2",
    "hash": "a6fc67fedaf9128a3309a1e2ebb8b986aeccf70122ee46d2cb4849e423f0c627",
    "signature": "authenticode:jqlang",
    "licenseDisposition": "MIT License accepted for task use"
  },
  "taskResult": {
    "status": "SUCCEEDED",
    "verification": {
      "taskId": "b038-s1-retain",
      "verifierId": "verifier.jit-cli",
      "verifierRevision": "r1",
      "status": "PASS",
      "checks": [
        {
          "checkId": "provider-task-observable",
          "status": "PASS",
          "detail": "task output names the exact acquired version 1.8.2"
        }
      ],
      "oracleInputs": {
        "expectedVersion": "1.8.2",
        "actualStdout": "jq-1.8.2\r\n"
      },
      "evidenceRefs": [
        "evidence\\b038-run-20261010\\s1-task-out\\stdout.txt"
      ]
    }
  },
  "lifecycleState": {
    "providerId": "tool.jq",
    "version": "1.8.2",
    "state": "RETAINED"
  },
  "residueReport": {
    "candidates": [],
    "unknownOrProtectedDeleted": false
  },
  "finalState": "RETAINED"
}